{
  "$schema": "https://json-schema.org/draft/2020-12/schema",
  "$id": "urn:agent-hub-core:v0.1:handoff-packet",
  "title": "Agent Hub HandoffPacket v0.1",
  "type": "object",
  "additionalProperties": false,
  "required": [
    "version",
    "project",
    "outcome",
    "verified_facts",
    "remaining_work",
    "acceptance_proof",
    "execution_envelope",
    "authoritative_refs"
  ],
  "properties": {
    "version": {
      "const": 1
    },
    "project": {
      "type": "string",
      "pattern": "^[A-Za-z0-9][A-Za-z0-9._-]{0,127}$"
    },
    "outcome": {
      "type": "string",
      "minLength": 1
    },
    "verified_facts": {
      "type": "array",
      "uniqueItems": true,
      "items": {
        "type": "string",
        "minLength": 1
      }
    },
    "remaining_work": {
      "type": "array",
      "minItems": 1,
      "uniqueItems": true,
      "items": {
        "type": "string",
        "minLength": 1
      }
    },
    "acceptance_proof": {
      "type": "array",
      "minItems": 1,
      "uniqueItems": true,
      "items": {
        "type": "string",
        "minLength": 1
      }
    },
    "execution_envelope": {
      "type": "object",
      "additionalProperties": false,
      "required": [
        "repositories"
      ],
      "properties": {
        "repositories": {
          "type": "array",
          "minItems": 1,
          "uniqueItems": true,
          "items": {
            "type": "string",
            "pattern": "^[A-Za-z0-9_.-]+/[A-Za-z0-9_.-]+$"
          }
        },
        "allowed": {
          "type": "array",
          "uniqueItems": true,
          "items": {
            "type": "string",
            "minLength": 1
          }
        },
        "forbidden": {
          "type": "array",
          "uniqueItems": true,
          "items": {
            "type": "string",
            "minLength": 1
          }
        }
      }
    },
    "authoritative_refs": {
      "type": "array",
      "minItems": 1,
      "items": {
        "type": "object",
        "additionalProperties": false,
        "required": [
          "type",
          "value"
        ],
        "properties": {
          "type": {
            "enum": [
              "repository",
              "file",
              "commit",
              "pull_request",
              "issue",
              "workflow_run",
              "artifact",
              "deployment",
              "runtime",
              "url",
              "other"
            ]
          },
          "value": {
            "type": "string",
            "minLength": 1
          }
        }
      }
    }
  }
}
